head_text,head_wiki_id,relation,tail_text,tail_wiki_id,count,ent_rel_pair,head_name,tail_name
SMI Small and Medium Industry viEXECUTIVE SUMMARY,id-less,country,Cameroon,Q1009,1,SMI Small and Medium Industry viEXECUTIVE SUMMARY country Cameroon,SMI Small and Medium Industry viEXECUTIVE SUMMARY_id-less,Cameroon_Q1009
SOCIAL,Q345367,part of,SOCIOLOGICAL,Q63511556,1,SOCIAL part of SOCIOLOGICAL,SOCIAL_Q345367,SOCIOLOGICAL_Q63511556
SOCIOLOGICAL,Q63511556,has part,SOCIAL,Q345367,1,SOCIOLOGICAL has part SOCIAL,SOCIOLOGICAL_Q63511556,SOCIAL_Q345367
Selected variables and indicators 58,id-less,has part,Annexe 1,Q100578427,1,Selected variables and indicators 58 has part Annexe 1,Selected variables and indicators 58_id-less,Annexe 1_Q100578427
Social development,Q15765794,has part,41,Q12564,1,Social development has part 41,Social development_Q15765794,41_Q12564
Space control 10,id-less,point in time,10,Q23806,1,Space control 10 point in time 10,Space control 10_id-less,10_Q23806
"THREATS, RISK FACTORS AND OBSTACLES 52",id-less,has part,OBSTACLES 52,id-less,1,"THREATS, RISK FACTORS AND OBSTACLES 52 has part OBSTACLES 52","THREATS, RISK FACTORS AND OBSTACLES 52_id-less",OBSTACLES 52_id-less
Tunisia,Q948,instance of,emerging country,Q33927642,1,Tunisia instance of emerging country,Tunisia_Q948,emerging country_Q33927642
Urban,Q159313,has part,regional development,Q482379,1,Urban has part regional development,Urban_Q159313,regional development_Q482379
V.1,Q580994,part of,INSTITUTIONAL AND POLITICAL LEVEL 53,id-less,1,V.1 part of INSTITUTIONAL AND POLITICAL LEVEL 53,V.1_Q580994,INSTITUTIONAL AND POLITICAL LEVEL 53_id-less
V.2,Q9367761,has part,At the social level 55,id-less,1,V.2 has part At the social level 55,V.2_Q9367761,At the social level 55_id-less
Vision for the next 25-30 years,id-less,country,Cameroon,Q1009,1,Vision for the next 25-30 years country Cameroon,Vision for the next 25-30 years_id-less,Cameroon_Q1009
Yaounde,Q3808,twinned administrative body,Douala,Q132830,1,Yaounde twinned administrative body Douala,Yaounde_Q3808,Douala_Q132830
administrative considerations 7,id-less,part of,Political and administrative considerations 7,id-less,1,administrative considerations 7 part of Political and administrative considerations 7,administrative considerations 7_id-less,Political and administrative considerations 7_id-less
agricultural revolution,Q6499967,location,rural sector,id-less,1,agricultural revolution location rural sector,agricultural revolution_Q6499967,rural sector_id-less
Political participation 11,id-less,point in time,11,Q37136,1,Political participation 11 point in time 11,Political participation 11_id-less,11_Q37136
Political and administrative considerations 7,id-less,has part,administrative considerations 7,id-less,1,Political and administrative considerations 7 has part administrative considerations 7,Political and administrative considerations 7_id-less,administrative considerations 7_id-less
Paris Declaration,Q2052298,instance of,guideline,Q1151067,1,Paris Declaration instance of guideline,Paris Declaration_Q2052298,guideline_Q1151067
Millennium Development Goals,Q81737,has part,fight against climatechange effects,id-less,1,Millennium Development Goals has part fight against climatechange effects,Millennium Development Goals_Q81737,fight against climatechange effects_id-less
III.1 strategy for national integration and consolidation of democracy,id-less,number of participants,34,Q712639,1,III.1 strategy for national integration and consolidation of democracy number of participants 34,III.1 strategy for national integration and consolidation of democracy_id-less,34_Q712639
IMPLEMENTATION STRATEGIES 33,id-less,point in time,33,Q712661,1,IMPLEMENTATION STRATEGIES 33 point in time 33,IMPLEMENTATION STRATEGIES 33_id-less,33_Q712661
INSTITUTIONAL AND POLITICAL LEVEL 53,id-less,has part,V.1,Q580994,1,INSTITUTIONAL AND POLITICAL LEVEL 53 has part V.1,INSTITUTIONAL AND POLITICAL LEVEL 53_id-less,V.1_Q580994
IV,Q202,has part,POTENTIAL RESOURCES 48,id-less,1,IV has part POTENTIAL RESOURCES 48,IV_Q202,POTENTIAL RESOURCES 48_id-less
IV.2 RESOURCE MOBILIZATION,id-less,number of participants,48,Q712764,1,IV.2 RESOURCE MOBILIZATION number of participants 48,IV.2 RESOURCE MOBILIZATION_id-less,48_Q712764
Implementation strategies,Q93931278,facet of,implementation strategies,Q93931278,1,Implementation strategies facet of implementation strategies,Implementation strategies_Q93931278,implementation strategies_Q93931278
Indonesia,Q252,instance of,emerging country,Q33927642,1,Indonesia instance of emerging country,Indonesia_Q252,emerging country_Q33927642
International integration strategy 42,id-less,point in time,42,Q812996,1,International integration strategy 42 point in time 42,International integration strategy 42_id-less,42_Q812996
Malaysia,Q833,instance of,emerging country,Q33927642,1,Malaysia instance of emerging country,Malaysia_Q833,emerging country_Q33927642
Millennium Development Goals,Q81737,creator,MDG,Q81737,1,Millennium Development Goals creator MDG,Millennium Development Goals_Q81737,MDG_Q81737
Morocco,Q1028,instance of,emerging country,Q33927642,1,Morocco instance of emerging country,Morocco_Q1028,emerging country_Q33927642
PRSP,Q7250831,country,Cameroon,Q1009,1,PRSP country Cameroon,PRSP_Q7250831,Cameroon_Q1009
National integration,Q100373677,facet of,democratic process,Q97571552,1,National integration facet of democratic process,National integration_Q100373677,democratic process_Q97571552
New Economic Partnership for Africa’s Development,id-less,field of work,Poverty Reduction,Q1824165,1,New Economic Partnership for Africa’s Development field of work Poverty Reduction,New Economic Partnership for Africa’s Development_id-less,Poverty Reduction_Q1824165
OBJECTIVES 17,id-less,point in time,17,Q40118,1,OBJECTIVES 17 point in time 17,OBJECTIVES 17_id-less,17_Q40118
OBSTACLES 52,id-less,part of,"THREATS, RISK FACTORS AND OBSTACLES 52",id-less,1,"OBSTACLES 52 part of THREATS, RISK FACTORS AND OBSTACLES 52",OBSTACLES 52_id-less,"THREATS, RISK FACTORS AND OBSTACLES 52_id-less"
ONE,Q199,part of,PART ONE,Q2054215,1,ONE part of PART ONE,ONE_Q199,PART ONE_Q2054215
PART FIVE,Q7140109,part of,FIVE,Q203,1,PART FIVE part of FIVE,PART FIVE_Q7140109,FIVE_Q203
PART FOUR,Q66474026,part of,FOUR,Q202,1,PART FOUR part of FOUR,PART FOUR_Q66474026,FOUR_Q202
PART ONE,Q2054215,has part,ONE,Q199,1,PART ONE has part ONE,PART ONE_Q2054215,ONE_Q199
PARTNERSHIP,Q728646,part of,ECONOMY,Q159810,1,PARTNERSHIP part of ECONOMY,PARTNERSHIP_Q728646,ECONOMY_Q159810
POTENTIAL RESOURCES 48,id-less,part of,IV,Q202,1,POTENTIAL RESOURCES 48 part of IV,POTENTIAL RESOURCES 48_id-less,IV_Q202
water,Q283,subclass of,social services,Q11588306,1,water subclass of social services,water_Q283,social services_Q11588306
